time,Speaker,text
00:01.2 - 00:04.1,robot,Now I would like to ask you a couple of word problems.
00:08.6 - 00:13.8,robot,"There are five groups of four students, how many students are there in the class?"
00:15.3 - 00:15.6,participant,20
00:19.7 - 00:21.3,robot,"good job, you are correct"
,participant,hahaha
00:29.0 - 00:36.7,robot,"each group has two beers of scissors, how many pairs of scissors are there in total?"
00:38.3 - 00:39.4,participant,10
00:47.2 - 00:49.2,robot,"Great, thank you for your answer."