time,Speaker,text
00:00.0 - 00:01.6,robot,ask you a couple of word problems.
00:06.3 - 00:11.5,robot,"There are five groups of four students, how many students are there in the class?"
00:13.3 - 00:14.0,participant,20
00:15.1 - 00:16.7,robot,"Well, done, you are so smart."
00:22.9 - 00:23.6,robot,each group
00:43.6 - 00:49.1,robot,"each group has two pairs of scissors, how many pairs of scissors are there in total?"
00:52.8 - 00:53.3,participant,10
00:57.9 - 00:59.5,robot,"Good job, you are correct."