time,Speaker,text
00:00.0 - 00:01.9,robot,i would like to ask you a couple of math questions.
00:03.5 - 00:10.9,robot,"If x = 4 and next plus b e = 10 the question, is is b equal a 12th."
00:14.8 - 00:15.7,participant,Can you repeat the question?
00:17.7 - 00:27.4,robot,"No problem if x equals Four and the next plus b e = 10 the question, is is the equal of 12"
,,no.
00:28.8 - 00:30.5,robot,Well done you are so smart.
00:33.9 - 00:40.1,,Thank you for talking with me. Look at my tablet. Please scan this QR code to complet.