time,Speaker,text
00:00.0 - 00:01.3,robot,Are you a couple of words problems?
00:05.2 - 00:14.8,robot,There are 66 people in the plague around including 28 girls boys and teachers. How many teachers were there and then hold on?
00:28.7 - 00:29.9,participant,"hi pepper, I cannot remember the number of teachers."
00:37.0 - 00:38.8,robot,"Really, please try again."
00:41.5 - 00:50.9,robot,There are 66 people when they're playing around including 28 girls boys and teachers. How many teachers were there in total?
00:57.4 - 01:00.8,participant,More than one more than zero.
01:04.4 - 01:07.5,robot,"i am sorry, maybe this question is too difficult."